{
  "schema_version": "intake.service-status.v1",
  "producer": {
    "service": "zalo-intake",
    "build_id": "zalo-intake+2026-09-24.demo"
  },
  "observed_at": "2026-09-24T08:00:00+07:00",
  "listener": {
    "state": "connected",
    "last_heartbeat_at": "2026-09-24T07:59:45+07:00",
    "session_id": "5e550000-0000-4000-8000-000000000001"
  },
  "pending": {
    "packages": 2,
    "oldest_sequence": 4,
    "oldest_age_seconds": 3600
  },
  "storage": {
    "ack_bytes": 900000000,
    "ack_cap_bytes": 1073741824,
    "ack_warn": true
  },
  "capabilities": {
    "source_event_types": {
      "recall": "supported",
      "reaction": "supported",
      "edit": "unsupported"
    }
  }
}
